{
  "schema_version": 1,
  "city": {
    "schema_version": 1,
    "name": "Small fixed-city demonstration",
    "width": 5,
    "height": 5,
    "placements": [
      {
        "id": "office",
        "facility_id": 2,
        "x": 2,
        "y": 1,
        "orientation": "v",
        "fixed": true
      }
    ],
    "designer_state": "",
    "source_url": null
  },
  "mode": "fixed",
  "goal": "max_additions",
  "additions": [
    {
      "facility_id": 1,
      "min_count": 0,
      "max_count": 4
    }
  ],
  "locked_ids": [],
  "time_limit_seconds": 30.0,
  "workers": 1,
  "random_seed": 0,
  "use_hints": true,
  "symmetry_breaking": true
}
